rank,content_topic,opportunity_score,market_frequency_pct,posts_count,coverage_rate,avg_engagement_rate,top_keywords,recommended_format,recommended_frequency,reasoning
1,Technical Skills & Tools,70.71,77.8%,1,0.03,28.42,"excel, sql, data analysis",Image,3x per week,"77.8% of 'Data' job postings in Indonesia mention this topic — employers actively look for these skills in candidates. Only 1 post has covered this topic so far, which is far below the market demand. Most frequently mentioned keywords in job postings: excel, sql, data analysis. Existing posts on this topic average 28.42% engagement rate (above the account average of 27.13%)."
2,Leadership & Management,65.08,65.1%,0,0.0,0.0,"management, coordinate, strategic",Image,3x per week,"65.1% of 'Data' job postings in Indonesia mention this topic — employers frequently seek leadership qualities in candidates. @belajarlinkedin has never created content on this topic out of 33 total posts. Most frequently mentioned keywords in job postings: management, coordinate, strategic."
3,Problem Solving & Analytical,44.44,44.4%,0,0.0,0.0,"problem solving, data driven, analytical thinking",Image,2x per week,"44.4% of 'Data' job postings in Indonesia mention this topic. @belajarlinkedin has never created content on this topic out of 33 total posts. Most frequently mentioned keywords in job postings: problem solving, data driven, analytical thinking."
4,Soft Skills & Communication,40.91,50.0%,2,0.061,38.66,"collaboration, verbal, presentation",Image,2x per week,"50.0% of 'Data' job postings in Indonesia mention this topic. Only 2 posts have covered this topic — far below the high market demand. Most frequently mentioned keywords in job postings: collaboration, verbal, presentation. Existing posts on this topic average 38.66% engagement rate (above the account average of 27.13%)."
5,Networking & Relationship,40.4,55.6%,3,0.091,21.57,"stakeholder, cross functional, relationship",Image,2x per week,"55.6% of 'Data' job postings in Indonesia mention this topic. Only 3 posts have covered this topic — below the high market demand. Most frequently mentioned keywords in job postings: stakeholder, cross functional, relationship. Existing posts on this topic average 21.57% engagement rate (below the account average of 27.13%)."
